{
  "$id": "https://netbeing.net/cheap/catalog.schema.json",
  "$schema": "https://json-schema.org/draft/2020-12/schema",
  "title": "Catalog",
  "description": "A complete Catalog in the Cheap data model, serving as the top-level container for hierarchies and aspects",
  "type": "object",
  "properties": {
    "globalId": {
      "type": "string",
      "format": "uuid",
      "description": "The globally unique identifier for this catalog entity"
    },
    "uri": {
      "type": ["string", "null"],
      "format": "uri",
      "description": "The URI for this catalog entity; typically a URL"
    },
    "species": {
      "type": "string",
      "enum": ["source", "sink", "mirror", "cache", "clone", "fork"],
      "description": "The species of this catalog"
    },
    "hierarchies": {
      "type": "object",
      "additionalProperties": {
        "$ref": "hierarchy.schema.json"
      },
      "description": "Directory of hierarchies contained within this catalog, keyed by hierarchy name"
    },
    "aspectDefs": {
      "type": "object",
      "additionalProperties": {
        "$ref": "aspectdef.schema.json"
      },
      "description": "All aspect definitions in this catalog, keyed by aspect definition name"
    }
  },
  "required": ["globalId", "species", "hierarchies", "aspectDefs"]
}
