{
  "globalId" : "550e8400-e29b-41d4-a716-444444444444",
  "uri" : null,
  "species" : "sink",
  "aspectDefs" : {
    "person" : {
      "name" : "person",
      "propertyDefs" : [ {
        "name" : "age",
        "type" : "Integer"
      }, {
        "name" : "name",
        "type" : "String",
        "isNullable" : false
      } ]
    },
    "document" : {
      "name" : "document",
      "propertyDefs" : [ {
        "name" : "title",
        "type" : "String",
        "isNullable" : false
      }, {
        "name" : "description",
        "type" : "String"
      } ]
    }
  },
  "hierarchies" : {
    "person" : {
      "type" : "AM",
      "name" : "person",
      "contents" : {
        "10000000-0000-0000-0000-000000000001" : {
          "age" : 30,
          "name" : "John Doe"
        },
        "10000000-0000-0000-0000-000000000002" : {
          "age" : 25,
          "name" : "Jane Smith"
        }
      }
    },
    "document" : {
      "type" : "AM",
      "name" : "document",
      "contents" : {
        "10000000-0000-0000-0000-000000000003" : {
          "title" : "User Manual",
          "description" : "Complete user guide"
        },
        "10000000-0000-0000-0000-000000000004" : {
          "title" : "API Documentation",
          "description" : "REST API reference"
        }
      }
    },
    "userDirectory" : {
      "type" : "ED",
      "name" : "userDirectory",
      "contents" : {
        "admin" : "10000000-0000-0000-0000-000000000001",
        "user1" : "10000000-0000-0000-0000-000000000002",
        "guest" : "10000000-0000-0000-0000-000000000003"
      }
    },
    "taskQueue" : {
      "type" : "EL",
      "name" : "taskQueue",
      "contents" : [ "10000000-0000-0000-0000-000000000001", "10000000-0000-0000-0000-000000000002", "10000000-0000-0000-0000-000000000003", "10000000-0000-0000-0000-000000000001" ]
    },
    "activeUsers" : {
      "type" : "ES",
      "name" : "activeUsers",
      "contents" : [ "10000000-0000-0000-0000-000000000001", "10000000-0000-0000-0000-000000000002", "10000000-0000-0000-0000-000000000004" ]
    },
    "fileSystem" : {
      "type" : "ET",
      "name" : "fileSystem",
      "contents" : {
        "entityId" : "10000000-0000-0000-0000-000000000001",
        "children" : {
          "documents" : {
            "entityId" : "10000000-0000-0000-0000-000000000002",
            "children" : {
              "reports" : {
                "entityId" : "10000000-0000-0000-0000-000000000004"
              }
            }
          },
          "images" : {
            "entityId" : "10000000-0000-0000-0000-000000000003"
          }
        }
      }
    }
  }
}