{"globalId":"550e8400-e29b-41d4-a716-444444444444","uri":null,"species":"sink","aspectDefs":{"person":{"name":"person","propertyDefs":[{"name":"name","type":"String","isNullable":false}]}},"hierarchies":{"person":{"type":"AM","name":"person","contents":{"550e8400-e29b-41d4-a716-446655440000":{"name":"John Doe"}}}}}