{
  "globalId" : "550e8400-e29b-41d4-a716-444444444444",
  "uri" : null,
  "species" : "sink",
  "aspectDefs" : {
    "product" : {
      "name" : "product",
      "globalId" : "09348400-e24b-41d4-a716-446644440000",
      "propertyDefs" : [ {
        "name" : "tags",
        "type" : "String",
        "isMultivalued" : true
      }, {
        "name" : "scores",
        "type" : "Integer",
        "isMultivalued" : true
      }, {
        "name" : "ratings",
        "type" : "Float",
        "isMultivalued" : true
      }, {
        "name" : "title",
        "type" : "String",
        "isNullable" : false
      } ]
    }
  },
  "hierarchies" : {
    "product" : {
      "type" : "AM",
      "name" : "product",
      "contents" : {
        "550e8400-e29b-41d4-a716-446655440001" : {
          "tags" : [ "software", "productivity" ],
          "scores" : [ 98, 92 ],
          "ratings" : [ 4.7, 4.9 ],
          "title" : "Office Suite"
        },
        "550e8400-e29b-41d4-a716-446655440000" : {
          "tags" : [ "electronics", "gadget", "popular" ],
          "scores" : [ 100, 95, 87 ],
          "ratings" : [ 4.5, 4.8, 4.2 ],
          "title" : "Smart Watch"
        }
      }
    }
  }
}