{"globalId":"550e8400-e29b-41d4-a716-444444444444","uri":null,"species":"sink","aspectDefs":{"person":{"name":"person","globalId":"82758400-e24b-41d4-a726-446644440000","propertyDefs":[{"name":"name","type":"String","isNullable":false},{"name":"age","type":"Integer"}]}},"hierarchies":{"person":{"type":"AM","name":"person","contents":{}}}}