{
  "globalId" : "550e8400-e29b-41d4-a716-444444444444",
  "uri" : null,
  "species" : "sink",
  "aspectDefs" : { },
  "hierarchies" : {
    "userDirectory" : {
      "type" : "ED",
      "name" : "userDirectory",
      "contents" : {
        "admin" : "550e8400-e29b-41d4-a716-446655440000",
        "user1" : "550e8400-e29b-41d4-a716-446655440001"
      }
    }
  }
}